<?xml version="1.0" encoding="UTF-8"?>
<cifp xmlns:xsi="http://www.w3.org/2001/XMLSchema-instance" xsi:noNamespaceSchemaLocation="ex1-3_cifp.xsd">
  <alumne id="1">
    <nom>Byron</nom>
    <llinatges>Mateo Melero</llinatges>
    <data_naixement>26-03-1996</data_naixement>
    <data_matricula>6-10-2025</data_matricula>
    <curs>DAW</curs>
  </alumne>
  <professor id="2">
    <nom>Miquel</nom>
    <llinatges>Ferrer Amengual</llinatges>
    <data_naixement>21-04-1987</data_naixement>
    <data_incorporacio>05-03-2023</data_incorporacio>
    <departament>Informàtica</departament>
    <assignatura id_assignatura="2">
      <nom_assignatura cicle="DAW">Programació</nom_assignatura>
      <data_inici>10-10-2025</data_inici>
    </assignatura>
    <assignatura id_assignatura="3">
      <nom_assignatura cicle="DAM">Bases de dades</nom_assignatura>
      <data_inici>10-10-2024</data_inici>
      <data_final>26-05-2025</data_final>
    </assignatura>
  </professor>
</cifp>
